{"edges":[[0,1],[0,2],[0,4],[0,16],[0,32],[1,5],[1,9],[1,17],[1,65],[2,6],[2,10],[2,34],[2,66],[3,7],[3,11],[3,19],[3,35],[4,12],[4,20],[4,36],[4,68],[5,7],[5,13],[5,37],[5,69],[6,7],[6,14],[6,22],[6,38],[7,23],[7,71],[8,10],[8,12],[8,24],[8,72],[9,11],[9,25],[9,41],[9,73],[10,11],[10,26],[10,42],[11,15],[11,75],[12,13],[12,14],[12,44],[13,15],[13,29],[13,77],[14,30],[14,46],[14,78],[15,31],[15,47],[15,79],[16,18],[16,24],[16,48],[16,80],[17,19],[17,21],[17,49],[17,81],[18,19],[18,22],[18,26],[19,27],[19,83],[20,21],[20,22],[20,28],[20,52],[21,23],[21,29],[21,85],[22,54],[22,86],[23,31],[23,55],[23,87],[24,25],[24,28],[24,56],[25,27],[25,29],[26,30],[26,58],[26,90],[27,31],[27,59],[27,91],[28,30],[28,60],[28,92],[29,61],[29,93],[30,31],[30,62],[31,95],[32,33],[32,40],[32,96],[33,35],[33,37],[33,49],[33,97],[34,35],[34,50],[34,98],[35,39],[35,43],[36,37],[36,38],[36,100],[37,45],[37,53],[38,39],[38,102],[39,47],[39,55],[39,103],[40,42],[40,44],[40,56],[41,43],[41,45],[41,57],[42,43],[42,46],[42,106],[43,59],[43,107],[44,45],[44,60],[44,108],[45,47],[45,109],[46,47],[46,110],[47,63],[48,49],[48,50],[48,52],[48,112],[49,51],[49,57],[50,54],[50,58],[51,55],[51,59],[51,115],[52,53],[52,116],[53,55],[53,61],[53,117],[54,55],[54,62],[54,118],[56,57],[56,58],[56,120],[57,61],[57,121],[58,59],[58,122],[59,63],[60,61],[60,124],[61,63],[62,63],[62,126],[63,127],[64,65],[64,68],[64,72],[64,80],[64,96],[65,67],[65,97],[66,70],[66,74],[66,82],[67,71],[67,75],[67,83],[68,69],[68,70],[68,76],[69,85],[69,101],[70,71],[70,86],[70,102],[71,79],[71,103],[72,73],[72,74],[72,88],[73,77],[73,89],[73,105],[74,75],[74,78],[74,106],[75,91],[75,107],[76,77],[76,78],[76,92],[76,108],[77,109],[78,79],[78,94],[79,111],[80,81],[80,82],[80,84],[81,89],[81,113],[82,83],[82,90],[82,114],[83,87],[83,115],[84,85],[84,86],[84,92],[84,116],[85,117],[86,87],[86,94],[87,119],[88,90],[88,92],[88,120],[89,91],[89,93],[90,91],[90,94],[91,123],[92,93],[93,95],[93,125],[94,95],[94,126],[95,127],[96,98],[96,100],[96,112],[97,101],[97,105],[97,113],[98,99],[98,102],[98,106],[99,103],[99,107],[99,115],[100,101],[100,108],[100,116],[101,103],[101,109],[102,110],[102,118],[103,119],[104,105],[104,106],[104,108],[104,120],[105,107],[105,121],[106,122],[107,111],[108,110],[109,111],[109,125],[110,111],[110,126],[111,127],[112,113],[112,114],[112,120],[113,115],[113,117],[114,118],[114,122],[115,123],[116,118],[116,124],[117,119],[117,125],[118,119],[119,127],[120,124],[121,123],[121,125],[122,123],[122,126],[123,127],[124,125],[124,126]],"source":"minamominamoto/c4free-hypercube q7_edges_304.jsonl.part1 line 1 at commit 894d58dbb778841be96812faebd30addf8babcf6","claimed_score":"448/1","claimed_improvement":"144/1"}
